-1,urgent busi propos partnership kuma savimbi kumasavimbimaktoobcom fri 8 nov 2002 000828 0000 mail know may embarrass embarrass mean come somebodi never know met even come countri perhap dont even know ghana note dishonest fruadulet practic well one scam leter ghana africa countri famili distress requir assist write introduc kuma savimbi first son paul edward savimbi murder rebel leader unita rebel movement angola prior father death entrust sum twenti four million unit state dollar us24m 400kg alluvi gold dust 995 puriti deposit secur compani safe keep im privileg document first son death first son claus deposit agreement compani say foreign partner allow collect consign behalf henc never want trace amount popular african leader unfortun mention us mother name foreign partner die im contact assist us clearanc consign secur compani transfer bank account invest perhap countri money gotten sale diamond father sold arm ammunit firm russia saw golden opportun sinc father kill command mean war soon decid divert convey money destin due happen countri soldier govern functionari loot govern fund properti follow polit crisi forc leav countri ghana mother brother sister cote divoir present live accraghana asylum seeker pend outcom applic file behalf attorney travel document depart home affair accord financi law ghana asylum seeker financi right like open bank account make larg invest countri view coupl way money acquir decid invest money african countri involv ghana peac process also involv unit nation peac keep forc angola make fear money invest ghana african countri might loos therefor appeal ask assist transfer money invest purpos either countri countri outsid africa prepar offer 15 total sum effort 85 famili invest ask appeal complet assur money safe soon transfer bank account account wish money transfer outsid africa interest assist pleas contact undersign immedi email phone detail forward upon receipt respons expect rapid respons cooper best regard kuma savimbi altern emailkumasavimbiyahoocom bewar imperson nb transact risk free confid trust watchword work togeth realiz object herebi inform necessari document regard consign rest assur bewar imperson 
+1,soviet union featur uk grain export london march 31 soviet union featur promin uk grain export outsid ec period juli 1march 13 take combin total 110 mln tonn wheat barley alldestin uk export 716 mln tonn home grown cereal author said quot provision custom excis figur soviet total compris 634000 tonn wheat 472000 tonn barley grain trader said figur underst shipment alreadi made sever thousand tonn expect total uk grain export ussr season reach 25 mln tonn compris 15 mln wheat10 mln barley reuter 
+1,cocoa buffer stock compromis gain accept london march 27 final compromis propos cocoa buffer stock rule present intern cocoa organ icco council chairman deni bra kanon swiftli gain accept consum produc member deleg said close nearer ever accept still work produc spokesman mama moham ghana told reuter produc meet european commun ec deleg said ec consum accept packag morn meet predict problem get full consum accept deleg side keen come agreement today last day fortnightlong council meet said compromis requir buffer stock purchas nonicco member countri cannot exceed 15 pct total buffer stock purchas deleg said nonmemb cocoa issu among contenti rule negoti 15 pct figur five percentag point earlier propos repres concess consum deleg said demand larger allow nonmemb cocoa buffer stock produc want anoth problem area deleg said question price differenti differ origin cocoa bought buffer stock buffer stock manag could fairli compar rel price differ cocoa offer compromis narrow rang differenti origin previou propos detail move deleg describ fiddl adjust may prove signific enough appeas countri satisfi origin propos differenti assign deleg said compromis also state buffer stock purchas day would limit 40 pct nearbi intermedi forward posit deleg said compromis accept council consum produc want buffer stock rule take effect next week soon practic possibl full council schedul meet around 1500 gmt discuss compromis could agre parti satisfi said consum due meet council reuter 
-1,india japan discuss iron ore price new delhi march 5 stateown miner metal trade corp send team japan next week negoti iron ore export contract 198788 begin april 1 trade sourc said japan biggest buyer indian iron ore import around 23 mln tonn year ask india reduc price current averag 18 dlr tonn sourc said japan said may forc reduc ore import india next year new delhi fail reduc price one sourc said declin give detail reuter 
+1,grain certif redempt put 240 mln bu kansa citi march 9 240 mln bushel govern grain alloc redempt commod certif sinc program began april 30 accord commod credit corpor redempt includ 114 mln bushel corn valu 170 mln dlr averag perbushel price 1492 dlr sinc current grain catalog issu decemb 1 ccc wheat redempt total 96 mln bushel valu 237 mln dlr sinc decemb 1 
-1,slater ltssiato plan us modern toronto april 13 slater industri inc said plan 15 mln dlr modern slater steel corp fort wayn specialti bar divis indiana said modern would involv replac exist bar mill highspe quickchang continu mill new facil lower labor mill cost enhanc product qualiti rang slater said complet date new mill undisclos reuter 
+1,pakistan bid import 100000 tonn sugar karachi march 30 trade corp pakistan ltd said invit tender april 11 1987 import 100000 tonn white refin crystal sugar june said cargo consist 15000 tonn four cargo reach port bin qasim karachi port buyer option may 31 balanc june 30 1987 ad reuter 
+1,lyng say decis taken cabinet council washington march 6 us agricultur secretari richard lyng said decis taken today white hous econom polici council meet speak report return meet lyng said five minut session dealt agricultur issu decis make meet lyng said aid lyng earlier said administr agricultur legisl propos would farmrel topic agenda lyng would comment farm issu discuss ask would respond farm group congressmen urg us offer wheat bonu soviet union lyng said would listen noncommitt reuter 
-1,australian metal trader link asturiana de zinc brisban march 11 ltmetal trader australasia ltd said newlyform subsidiari ltaustmet ltd group negoti exclus longterm contract spain ltasturiana de zinc market zinc metal export metal trader said statement contract would underpin worldwid zinc copper lead trade activ austmet whollyown londonbas compani us unit stamford connecticut austmet recruit group base metal trader current oper britain us handl asturiana busi past five year said asturiana threeyear option purchas 25 pct austmet group price independ valuat time exercis metal trader said austmet initi equiti base one mln stg turnov 200 mln australian dlr rise 300 mln first year credit line 30 mln us dlr austmet gener profit juli 1 1525 mln dlr net envisag within two year said metal trader said asturiana largest zinc smelt capac europ nearli 200000 tonn year 99995 pct highgrad zinc avil northern spain metal trader list compani formerli ltpyrotech resourc nl whose chief activ develop market hightechnolog smelt process invent australia notabl siromelt zinc fume process late 1986 control compani chang expand acquisit metal trade australia asia chang name also market contract miner sand produc lttio2 corp nl hold 175 pct today statement metal trader also said review possibl acquisit miner produc reuter 
+1,usda estim australia wheat crop washington march 9 us agricultur depart forecast australia 198687 wheat crop 1730 mln tonn vs 1750 mln tonn last month estim 198586 output 1613 mln tonn vs 1613 mln last month australian wheat export 198687 forecast 1450 mln tonn vs 1500 mln tonn last month export 198586 estim 1596 mln tonn vs 1596 mln last month reuter 
+1,usda report 10572 mln acr conserv washington march 13 us agricultur depart accept 10572402 acr highli erod cropland conserv reserv program usda announc latest signup farmer 101020 farm submit bid total 11254837 acr accept bid annual rental payment rang 90 dlr per acr averag 5117 dlr per acr land enter conserv reserv program inelig farm ten year must plant perman veget cover produc enrol 1894764 acr corn base acreag conserv program take advantag corn bonu rental payment offer usda corn bonu paid gener comod certif amount two dlr per bushel base asc program payment yield corn acr corn base accept reserv state show biggest enrol conserv program signup texa approxim 1225 mln acr follow iowa 1030 mln acr minnesota 890000 acr montana 875000 acr kansa 842000 acr state show big enrol missouri 646000 acr north dakota 588000 acr nebraska 554000 acr corn belt state illinoi indiana 217000 acr 116000 acr respect enrol farm land sign date conserv program total 19488587 acr bid previou signup rang 90 dlr per acr averag 4552 dlr reuter 
+1,cacex deni brazil fcoj price rise rumour rio de janeiro march 4 rise price frozen concentr orang juic fcoj spokesman banco brasil foreign trade depart cacex said respond rumour intern market brazil rais fcoj price rang 1075 1150 dlr per tonn reuter 
-1,african union object plan matthey move johannesburg june 18 south african trade union disput subsidiari britain johnson matthey plc compani propos move platinum refineri near johannesburg black tribal homeland 30000member mainli black chemic worker industri union said fear plan move bophuthatswana homeland south african union recognis could lead job loss affect wage mass dismiss last year impala platinum hold ltd ltiplaj mine tribal homeland sent world platinum price rocket union said talk manag propos move broken said earlier ballot refineri worker show favour strike move ad final decis taken strike action refineri process platinum metal rustenburg platinum hold ltd world largest platinum produc own matthey rustenburg ltd jointsubsidiari johnson matthey rustenburg turn own mine group johannesburg consolid invest co ltd reuter 
+1,ec grant free market barley maiz export london april 9 european commiss authoris export 65000 tonn free market barley today tender maximum rebat 13875 european currenc unit 55000 tonn french maiz 130 ecu grain trader said reject bid breadmak feed wheat said reuter 
+1,oklahoma weekli crop report oklahoma citi march 30 oklahoma weekli usda crop report said cold weather slow crop develop caus cattl death wheat growth halt cold weather rain earli week prevent fertil applic weed spray field west short nitrogen moder insect activ note southwest region wheat condit rate 15 pct fair 84 pct good one pct excel row crop activ slow amid wet condit topsoil moistur rate 30 pct adequ 70 pct surplu subsoil moistur rate 100 pct adequ two day suitabl fieldwork reuter 
+1,malaysia declin state posit cocoa pact kuala lumpur april 1 govern offici malaysia major cocoa produc declin say whether join intern cocoa agreement icca buffer stock rule agre london last week ministri primari industri offici said januari cabinet would decid malaysia particip far decis announc govern said favour join pact local cocoa grower trader told reuter idea certain provis may disadvantag malaysia world fourth largest cocoa produc govern feel pact buffer stock mechan help stabilis price market labour surplus offici said grower trader concern malaysia particip pact requir pay levi export cocoa nonmemb countri icca estim levi around 100 ringgit tonn current price said prepar accept big portion malaysia cocoa export offici estim 112000 tonn 1986 goe nonmemb grower trader ad also buffer stock measur agreement requir withhold cocoa stock price slump malaysia produc 117000 tonn cocoa last year might forc withhold 70000 tonn worth 30 mln ringgit measur longterm might affect econom viabil said cost maintain stock high real messi busi govern trade ever occur industri sourc said grower trader also said new buffer stock rule malaysia continu benefit even member pact buffer stock manag also allow buy nonmemb stockpil new rule purchas nonmemb malaysia limit 15 pct total stock malaysia come pressur produc join pact soon offici said note need rush provis allow countri join agreement even later date reuter 
-1,steel firm studi usx ltx unit price hike new york june 18 two major steel compani said studi price increas announc yesterday usx corp uss steelmak divis spokesman armco inc lta bethlehem steel corp ltb said propos price hike studi yesterday uss said plan rais base price plate product 20 dlr ton five pct effect shipment octob 4 spokesman ltv steel co unit ltv corp ltqltv declin comment ad compani make heavi plate make plate product spokesman ltnation steel corp joint ventur nation intergroup inc ltnii nippon kokan kk said compani product line affect reach later inland steel industri inc ltiad spokesman said compani studi price move usx said increas plate product includ carbon highstrength lowalloy strip mill alloy plate also said plan 20dlraton increas special plate width thick analyst said firm price steel contribut better result nation major steelmak reuter 
+1,uk intervent bd say ec sold 60500 tonn white sugar rebat 43147 ecu date text 
-1,magma rais copper price 050 ct 6600 ct new york april 7 magma copper co subsidiari newmont mine corp said rais copper cathod price 050 cent 6600 cent lb effect immedi reuter 
-1,ball ltbll suppli penni blank mint munci ind april 7 ball corp said award oneyear 12750000 dlr contract suppli copperpl zinc penni blank us mint philadelphia denver new contract effect june call ship 23200000 pound blank mint philadelphia 7600000 pound denver said blank manufactur greenvil tenn ball began suppli blank san francisco west point mint 1981 penni content chang zinc copper reuter 
+1,cuba sugar crop seen least last year london march 13 cuban sugar export figur januari suggest year crop may least larg last year 735 mln tonn accord sugar analyst export januari total 733000 tonn raw valu 725000 year earlier accord figur receiv intern sugar organ januari first major export month figur thu give good indic current crop said fourth quarter export fell 622000 tonn 909000 tonn year earlier cuba destock end 1985 ad trade hous c czarnikow recent estim product year 750 mln tonn cuban sugar product third quarter 1986 12000 tonn give final 198586 crop total 735 mln tonn compar 198485 crop 810 mln tonn normal third quarter product cuba hurrican meant last year crop extend export ussr substanti januari 362000 tonn 489000 januari 1986 comecon countri receiv 210000 tonn 80000 tonn month last year figur receiv iso show bulgaria czechoslovakia poland romania took substanti cuban sugar cuba novemb 1986 export total 158000 tonn compar 190000 tonn 1985 decemb total 237000 tonn 518000 tonn year calendar year export 1986 also lower 669 mln tonn 721 mln 1985 lowest level sinc 1980 619 mln tonn figur show reuter 
-1,amax zinc co rais dyecast alloy price greenwich conn june 29 amax zinc co divis amax inc said increas price dyecast alloy three five three cent lb effect immedi dyecast alloy three 525 cent lb alloy five 535 cent lb compani said reuter 
-1,us silver product rose decemb washington april 3 us mine product silver rose 2295230 troy ounc decemb 2181082 novemb interior depart bureau mine said us import silver decemb 8458000 ounc vs 19950000 novemb 8840000 decemb 1985 silver export total 1549000 ounc decemb vs 2346000 novemb 1504000 ounc decemb 1985 silver mine product 12month period jandec 1986 total 31720769 ounc vs 39357197 ounc produc period 1985 import silver jandec 1986 total 144890000 ounc vs 152601000 ounc jandec 1985 silver export stood 25114000 ounc 24756000 ounc respect period bureau said reuter 
-1,cominco strike talk still stall trail british columbia june 15 cominco ltd contract negoti schedul week five strike local trail smelter kimberley leadzinc mine union spokesmen said howev leader negoti team tri set inform meet discuss stalem john owen spokesman unit steelwork america local 480 said owen said cominco said strike began may 9 cost five mln canadian dlr day debt servic cost cover revenu said compani estim total lost revenu cominco spokesmen immedi avail comment reuter 
+1,ico pact unlik autumn italian advis triest itali march 3 prospect intern coffe organ ico reach agreement coffe export quota septemb appear dim alberto hess former presid european coffe feder said real goodwil certain deleg go quota hess advis italian foreign affair ministri coffe issu told reuter declin name deleg special meet import export countri end deadlock late yesterday eight day talk set quota ico execut board meet march 30 april 1 full council due meet septemb optimist agreement soon hess said reuter 
-1,belgian ecu coin issu price sale date set brussel march 5 limit belgian issu silver ecu coin face valu five ecu go sale march 23 price 500 belgian franc financ ministri spokesman said gold ecu coin face valu 50 ecu sold day spokesman told reuter price would fix go sale like 8500 9000 franc least two mln silver coin sever hundr thousand gold coin mint said sold belgium abroad coin first ever denomin ecu basket compris 12nation european commun currenc except spanish peseta portugues escudo issu made mark 30th anniversari ec found treati rome month financ minist mark eysken current presid ec council econom financ minist call issu polit act symbol valu aim make commun goal monetari integr concret coin legal tender belgium demand expect come coin collector reuter 
-1,csc industri unit increas price warren ohio march 30 copperweld steel co ltcpsl subsidiari csc industri inc said increas market price level bar semifinish lead product effect juli one hot roll cold finish bar wil increas 25 dlr per net ton semifinish product increas 15 dlr per net ton compani said anticip higher energi raw materi cost combin current market trend cite compani reason increas reuter 
+1,soviet union import grain 8687usda washington april 9 us agricultur depart increas estim 198687 grain purchas soviet union 28 mln tonn two mln tonn last month monthli report soviet grain situat usda said import higher earlier estim soviet grain buyer activ purchas last month usda said increas purchas somewhat surpris recent higher soviet crop estim increas estim import corn usda said 28 mln tonn total 15 mln tonn wheat 12 mln tonn coars grain remain one mln tonn miscellan grain puls usda said usda note soviet winter grain crop suffer sever winter spring field work delay sever winter believ result averag winterkil usda said grain trade analyst said abnorm winter loss mayb one reason soviet union activ buy grain recent usda said moscow alreadi purchas 25 mln tonn grain deliveri 198687 includ 14 mln tonn wheat 12 mln tonn coars grain reuter 
+1,usda estim 198687 orang juic yield 150 gal per box florida crop date text 
-1,pegasu gold ltpgulf start mill montana jefferson citi mont march 27 pegasu gold inc said mill oper start montana tunnel openpit gold silver zinc lead mine near helena startup three month ahead schedul six mln dlr budget compani said origin capit cost mine 575 mln dlr came 515 mln dlr compani said startup period mill expect produc 106000 ounc gold 1700000 ounc silver 26000 ton zinc 5700 ton lead annual basi 4300000 ton ore compani said reuter 
-1,nippon steel inland discuss us joint ventur tokyo march 11 nippon steel corp ltnstct ltinland steel co us negoti set joint steel ventur indiana nippon steel spokesman said declin give detail sever local newspap report joint ventur would capitalis 150 mln dlr own 60 pct inland 40 pct nippon steel annual product capac one mln tonn steel suppli car maker reuter 
-1,us mint seek offer copper nickel washington april 7 us mint said seek offer 3701000 lb electrolyt copper 629000 lb electrolyt cut nickel cathod briquett intend purchas said metal deliveri week may 11 olin corp east alton ill offer copper due 1100 hr edt april 21 offer nickel due 1100 hr edt april 14 mint said firm submit offer select receiv payment standard check wire transfer award determin whichev two method cost advantag base cost money time minimum accept period solicit three calendar day copper 10 calendar day nickel mint said reuter 
-1,steel technolog ltsttx joint ventur louisvil ky march 30 steel technolog inc said sign agreement mitsui co ltd ltmitsi subsidiari establish joint ventur corpor call mitech steel inc mitsui subsidiari mitsui co usa inc mitsui steel develop co inc steel technolog 50 pct new compani compani said mitech steel construct oper steel servic center facil establish serv japanes domest automobil applianc part manufactur us compani said initi process center locat near murfreesboro tenn expect begin oper fall 1987 steel technolog said daryl elser presid steel technolog presid new compani said reuter 
+1,frost expect damag poland wheat warsaw march 4 poland winter wheat like surviv recent frost impact cold known late april polish meteorolog institut said varieti winter wheat sown poland surviv ground temperatur low minu 20 degre c spokesman teresa tomaszewska told reuter even though earlier thin protect layer snow mainli melt februari air temperatur minu 30 c harm said ad wheat still damag cold spell march april young shoot may expos night frost reuter 
+1,licht see stagnant european beet area ratzeburg march 11 overal area devot sugar beet europ forecast remain stagnant year 722 mln hectar compar 721 mln ha 1986 west german statistician fo licht said fear recent steep rise sugar price would mark effect plant intent year licht said judg first estim effect probabl minim total beet area european commun forecast fall two pct 185 mln ha 189 mln 1986 total western europ area put 249 mln ha 250 mln 1986 eastern europ area forecast 473 mln ha 472 mln individu west europ countri estim 1000 hectar 1986 figur bracket belgiumluxembourg 114 118 denmark 69 69 franc 419 421 greec 35 44 ireland 36 38 itali 270 275 netherland 129 138 portug 1 1 spain 192 190 uk 200 201 west germani 385 399 austria 32 28 finland 30 31 sweden 51 52 switzerland 15 14 turkey 355 340 yugoslavia 160 136 eastern europ plant forecast follow ussr 3400 3440 albania 10 9 bulgaria 52 50 czechoslovakia 195 196 east germani 210 205 hungari 108 96 poland 460 440 romania 295 280 basi averag yield year licht said area forecast point total european beet sugar crop 198788 298 mln tonn raw valu 314 mln tonn 198687 licht said sugar yield fairli high last season thank favour weather increas chanc signific reduct product 198788 base averag yield ec beet sugar product could fall nearli 10 pct year 135 mln tonn 149 mln 198687 total western europ product could 169 mln tonn 181 mln eastern europ product could 129 mln tonn 133 mln 198687 reuter 
-1,us miner ltusmxo commiss new gold mine denver june 29 us miner explor co said pegasu gold inc ltpgulo spokan wash offici commiss new gold zinc lead produc mine us miner said new montana tunnel mine near helena mont expect reach full product august 1987 us miner said mine design oper averag 12500 ton ore per day project produc 95000 ounc gold 1988 plu signific quantiti silver lead zinc us miner said 50 pct net profit royalti interest mine payback develop cost reuter 
