-1,zambian copper industri hope steadi output lusaka june 18 zambia copper mine industri hope achiev maintain product 500000 tonn year next year despit low world price deterior ore shortag mine input industri offici said zambia decis abandon last may 1 tough intern monetari fund imf econom recoveri program introduc element uncertainti plan restructur ail industri boost profit said copper product governmentcontrol zambia consolid copper mine zccm 1987 financi year end march 31 improv slightli 471000 tonn record 1986 low 463354 tonn convinc end 1988 financi year copper product could well 500000 tonn due greater avail spare equip zccm offici said zccm offici said product cobalt anoth strateg incom earner also tailor meet demand finish product 1986 4565 tonn 911 tonn higher previou year best product achiev date protract low world metal price badli hit copper industri zambia world fifth biggest produc mine monopolis zccm account 90 pct countri foreign exchang earn product also serious affect recent year equip breakdown deterior ore shortag spare part fuel lubric 463354 tonn output last year compar peak 1975 output 700000 tonn fiveyear product invest plan launch 1984 zccm fund european commun african develop bank world bank plan forese shutdown seven mine metallurg unit ground unprofit zccm second largest employ govern said intend lay 20000 60000 workforc part plan 250 mln dlr far channel industri bid improv effici profit fiveyear restructur plan compani offici said although reserv deplet zambia could continu produc copper beyond end centuri though lower level product industri sourc said zccm project pretax profit financi year end march 31 would around 500 mln kwacha current miner export tax level levi net loss like regist zccm record net loss 718 mln kwacha 1986 compar net profit 19 mln kwacha year foreign exchang auction system introduc 1985 zccm profit foreign exchang earn rose valu kwacha fell 21 dollar two dollar may 1 presid kenneth kaunda abolish auction system inspir intern monetari fund announc zambia would pursu goitalon econom strategi base nation resourc zccm offici still cautiou effect break imf industri plan still consult see new measur affect us earli say shall fare new situat peter hansen director oper third zccm hierarchi told reuter analyst believ new officiallyfix exchang rate eight kwacha dollar hit zccm export profit specialist talk tell breakeven point zccm rate 10 kwacha per dollar frederick chiluba leader zambian congress trade union said high product cost continu bedevil zambian industri zambia mine copper rel expens rate 69 cent per pound compar 55 cent unit state 40 cent chile industri also face transport problem due zambia landlock govern confirm year stop sbend copper south south africa 80 pct shipment 35000 tonn month sent rail tanzanian port daressalaam 5000 tonn go via zimbabw mozambiqu port beira transport often hit shortag wagon spare fuel reuter 
-1,intl phoenix energi ltipyv join gold ventur vancouv british columbia june 15 intern phoenix energi corp said launch gold recoveri ventur ltphoenix explor recoveri inc mexico sistema tecnico de recuperacion sociedad anonima de capit variabl compani said joint ventur explor recov gold preciou metal artefact treasur ship worth 10 billion dlr report sunk harbor area vera cruz mexico compani said expect work begin 30 day reuter 
-1,major european zinc smelter merger seen 1990 amsterdam june 16 least one merger major european zinc smelter end decad christian bue execut vice presid comm rcial smm penarroya franc said speak second day metal bulletin base metal confer bue said expect current talk five smelter includ penarroya result integr least compani 1990 five compani smm penarroya outokumpu oy preussag ag ste de la vieill montagn boliden ore metal ab 22 pct world market bue ad altern integr busi larg trade bloc surviv cutthroat price competit trend forward integr mine compani bue said mean certain five compani involv talk integr togeth quit like even prefer european smelter form two three larg integr bloc way better abl negoti concentr supplier one side metal buyer bue ad past product overcapac intens competit european zinc smelter meant weak negoti posit buy concentr even weaker one sell metal bue note although appar easi solut simpli shut excess capac burden individu compani far heavi one expect volunt ad anoth possibl riski solut invest heavili modern lower cost facil said answer suggest individu compani invest sure die invest might surviv might bue said real option mind integr ration stabil altern ad bue also said european smelter complet dissatisfi tradit price concentr metal us dollar suggest move either basket world major currenc price european currenc unit ecu protect exchang rate volatil bue view integr european smelter met gener approv confer audienc compris repres mani world major mine smelt trade compani although mine repres somewhat sceptic view industri move toward integr smelter howev concentr trader express worri posit metal industri make move larg trade bloc currenc basket suggest crop constantli said thought matter would chang near futur reuter 
-1,noranda set temporari mine shutdown murdochvil quebec april 3 ltnoranda inc said product remain shut firedamag copper mine complet examin mine fire start wednesday burn late yesterday kill one miner trap 56 other underground 24 hour 56 eventu brought safe mine compani spokesman dale coffin said investig could take day sever week would specif noranda said resum product plan oper mine onethird normal 72000 metric ton annual finish capac fire weaken part mine support structur coffin said noranda said decid keep mine open would take four five month could resum full product reuter 
+1,ny analyst see coffe futur fall new york april 1 new york coffe futur price probabl fall 85 cent lb next month consolid trend set accord market analyst yesterday price spot may contract fell 100 dlr lb first time sinc august 1981 intern coffe organ place new export quota discuss current agenda talk aim renegoti ico export quota five year pricesupport agreement broke februari shortterm look like definit test 90 cent perhap 85 cent said william oneil coffe analyst elder futur addit downsid may great current level price level market vulner bullish develop oneil ad rather us market plummet well kind see price erod probabl around 85 cent definit see 90 cent would rule brief drop 85 cent said debra tropp coffe analyst prudenti bach said june worri freez brazil grow area becom market factor price like consolid ahead time trader major intern trade hous ask name said expect 10 cent drop near term believ brazil open may registr rel high export price requir high contribut quota export market could steadi lower level longer term ad produc pressur mount brazil agre consum export quota term new intern agreement could come forc next fall sinc februari talk broke market fallen 13000 cent lb low 9810 cent lb today buyer seller sought reassess suppli demand gener analyst say produc larg buildup stock us roaster drawn suppli need buy soon produc nation complet complet annual harvest export suppli season peak export remain behind year ago warehous produc nation becom increasingli overburden said sandra kaul coffe analyst shearson lehman firm forthcom quarterli coffe report kaul said produc need procur hard currenc servic foreign debt put pressur sell keep substanti pressur export undertak sale despit drop price six year low kaul believ market drop 80 cent lb brazil frost season begin june accur assess roaster demand hard come though analyst note peak winter consumpt period pass demand usual slow time year shearson kaul estim us roaster end stock januari 31 includ solubl roast 63 mln bag compar 69 mln endseptemb 1986 small drawdown usual busi winter roast season elder oneil said roaster overstock mean analyst said pick bottom market difficult given fact price fallen unchart territori longterm support 100 dlr per lb sever trader said sidelin might prefer short term reuter 
+1,china rais grain purchas price peke april 13 china rais state purchas price corn rice cottonse shell peanut april 1 encourag farmer grow offici china commerci daili said paper said price paid corn 14 northern provinc citi region increas one yuan per 50 kg foreign agricultur expert said rise take price 17 fen per jin 05 kg 16 fen paper said price longgrain rice 10 southern provinc citi rais 15 yuan per 50 kg paper said price roundgrain rice 11 provinc region citi central east northwest china increas 175 yuan per 50 kg gave price detail said local author must inform farmer price increas farmer begin plant encourag product grain oilse chines offici said farmer unwil grow grain earn crop reuter 
+1,north yemen call sugar buy tender trade london april 8 north yemen call buy tender saturday purchas 30000 tonn white sugar arriv june trader said reuter 
-1,cominco strike talk schedul trail british columbia june 19 cominco ltd said talk schedul strike worker trail smelter kimberley british columbia leadzinc mine compani spokesman said compani union met inform tuesday talk constitut formal bargain session last formal talk june 5 worker went strike may 9 product shut sinc trail smelter produc 240000 long ton zinc 110000 long ton lead last year sullivan mine kimberley produc 22 mln long ton ore 1986 process trail smelter reuter 
+1,agenc review johnsonjohnson ltjnj sweetner new brunswick march 11 johnson johnson said us food drug administr notifi compani food addit petit highintens sweeten formal accept review agenc compani said product gener name sucralos made sugar tast like sugar 600 time sweeter yield calori promot tooth decay reuter 
+1,uk intervent board detail ec sugar sale london april 8 total 118350 tonn current seri white sugar receiv export rebat maximum 46496 european currenc unit ecu per 100 kilo today european commun ec tender uk intervent board said trader uk receiv 37800 tonn franc 34500 west germani 20000 belgium 18500 spain 5800 denmark 1750 tonn ad earlier today london trader declin give project view level subsidi although said total tonnag award would around 60000 tonn pari trader foresaw 60000 100000 tonn authoris export 46404650 ecu subsidi cumul sale authoris current season 198687 stand 2194970 tonn 43 week last week saw 102350 tonn white authoris export licenc endsep higest ever rebat 46864 european currenc unit ecu per 100 kilo reuter 
+1,grain ship load portland portland april 1 five grain ship load three ship wait load portland accord portland merchant exchang reuter 
+1,colombia coffe registr remain open bogota april 8 colombia coffe export registr remain open plan close sinc new market polici mean unlimit amount regist gilberto arango presid privat export associ said philosophi new polici close registr nobodi far said may would close told reuter march 13 colombia open registr april may unlimit amount without give breakdown arango said privat export regist 1322804 bag calendar year april 6 roughli 440000 bag per month slightli lower averag recent year estim amount bag regist nation coffe grower feder mean total 900000 bag regist sold per month colombia chang could happen volum would told date registr would june shipment etc arango said reuter 
-1,ec commiss open attitud steel quota strasbourg march 12 ec commiss said adopt open attitud whether system product quota remain indefinit futur heavi steel product account 45 pct ec steel good statement commiss reiter view industri need lose 25 30 mln tonn capac 1990 previous said quota system start 1980 wound complet end next year industri argu mainten exist quota cover almost 70 pct output say almost steelmak lose money due depress market reuter 
+1,us see harmoni talk franc washington march 29 us expect harmoni talk usual french prime minist jacqu chirac first offici visit week frequent rancor disput two countri begin fade libyan b omb thing past trade war didnt happen reach reason good cooper terror one us offici told reuter look like reason harmoni visit prospect harmoni usual sinc take offic year ago chirac oblig deal seri potenti seriou disput unit state us bomb alleg terrorist target libya last april franc refus allow britishbas us plane overfli territori forc take circuit rout anger washington us offici ask identifi said year ago washington felt french take strong enough action terror pleas pleas pleas one said recent disput us access grain market spain portug join european commun threaten becom trade war retali washington saw deliber commun move exclud us grain unit state pois impos swing tariff european commun food import major trade war avert last minut last week forc presid hissen habr chad support train arm pari washington score major success push libyan troop last base northern chad french offici ad also common interest get japan cut trade surplu rest world open market although relat improv markedli two countri mani irrit remain top list commun common agricultur polici cap washington one offici put cap root evil intern food trade subsidis farmer sell vast amount excess produc world price therebi eat us market reuter 
+1,lower asc corn price affect ten state washington march 27 agricultur depart widen louisiana gulf differenti affect counti post price number two yellow corn ten state usda offici said counti iowa affect counti use gulf price corn illinoi indiana tennesse kentucki missouri mississippi arkansa alabama louisiana said ron burgess deputi director commod oper divis usda usda last night notifi grain industri effect immedi gulf differenti use price interior corn would widen slide scale basi four eight ct depend differenti usda action taken lower excess high post counti price corn caus high gulf price weve follow louisiana gulf situat month dont think go get back line nearbi time burgess said burgess said usda probabl narrow back gulf differenti gulf price reced mark high wouldnt much mark low said forecast adjust gulf price fall burgess said chang usda price system plan right dont tinker dont make chang lightli dont make chang often said reuter 
-1,noranda talk brunswick leadzinc miner toronto june 15 noranda inc said contract talk resum 1600 union worker 63 pctown brunswick mine smelter corp leadzinc mine lead smelter bathurst new brunswick noranda offici said talk involv mine smelter union local part unit steelwork america minework contract expir juli 1 vote june 22 either author strike ratifi possibl contract offer smelter worker pact expir juli 21 brunswick mine produc 413800 tonn zinc 206000 tonn lead last year recoveri rate 705 pct zinc 556 pct lead concentr produc 238000 tonn zinc 81000 tonn lead reuter 
+1,us credit ecuador switch veg oil washington march 31 commod credit corpor ccc switch five mln dlr credit guarante ecuador provid sale us veget oil us agricultur depart said credit guarante previous earmark sale us cotton feedgrain wheat action reduc guarante line previous author sale cotton 15 mln dlr 500000 dlr feedgrain four mln two mln wheat 45 mln dlr 43 mln dlr increas coverag veget oil sale two mln seven mln dlr depart said reuter 
+1,failur ec farm price talk disrupt tender london june 19 seriou bid european commun open market tender wheat barley ec farm minist agre 198788 farm price packag trade sourc said failur farm minist week come agreement result bid week tender export subsidi trader said bid unlik long uncertainti remain one trader said perman damag export prospect avoid agreemend reach soon situat becom seriou time pass howev trader said seem buyer around lessen disrupt impact delay poland south korea market feed wheat offer intervent grain special tender trader said reuter 
+1,us trade panel rule brazilian orang juic import impos dutu date text 
-1,gordex miner locat canada gold deposit saint john new brunswick april 9 gordex miner ltd said geologist locat one mln short ton goldbear deposit 0057 ounc per ton cape spencer compani said plan invest 25 mln canadian dlr expand onsit treatment facil process 100000 ton goldbear deposit year 200000 ton 1988 prior complet recent explor program gordex estim cape spencer deposit 200000 ton gordex said expans cape spencer facil intend enabl oper 24 hour day throughout year reuter 
+1,cocoa council agre new buffer stock rule deleg date text 
-1,bhp float gold unit oneforthre issu melbourn march 5 broken hill pti co ltd ltbrkn bhp said plan renounc oneforthre issu right float new compani ltbhp gold mine ltd bhpgm hold bhp gold interest statement bhp said 25cent par right would price 50 cent 430 mln bhpgm share offer bhp subscrib remain 540 mln share 56 pct issu capit term bhpgm pay 440 mln dlr bhp gold interest exclud stake papua new guinea ltok tedi mine ltd interest held bhp ltutah intern inc bhp statement said issu made sharehold regist march 27 open april 4 close april 29 underwritten ltjb son right trade australian stock exchang march 23 april 22 new share quot june 4 bhp said new compani one australia larger gold produc annual output exceed 170000 ounc said plan boost product 300000 ounc earli 1990 bhpgm portfolio includ sever australian mine 30 pct telfer 100 pct ora banda brown creek 20 pct new boddington develop statement said bhpgm would also hold bhp 45 pct stake coron hill properti northern territori 55 pct stake new ventur near gympi queensland bhpgm chairmandesign john gough said qualiti gold stock divers depth bhp gold portfolio give compani sound foundat current gold product excit potenti growth said reuter 
-1,sphinx mine ltspnxfo find gold fort smith ark oct 20 sphinx mine inc said leas mine claim alaska could produc revenu 322 mln dlr 966 mln dlr gold reserv rang valu reserv attribut wide rang grade estim ore compani said 1984 feasibl studi put grade 0008 ounc per cubic yard subsequ explor work prove area highergrad gravel 0027 ouncesyard exist sphinx said claim locat 80 mile northwest fairbank reuter 
+1,french winter cereal sow seen littl chang pari april 21 ministri agricultur left estim french winter cereal sow 198687 campaign bare chang 6606 mln hectar compar previou forecast 6601 mln compar 641 mln ha winter cereal harvest 198586 campaign winter soft wheat sow put 4647 mln ha compar previou estim 4651 mln 457 mln ha harvest last campaign winter barley plant forecast 146 mln ha unchang previou estim compar 141 mln harvest last season ministri put hard winter wheat sow 246000 ha versu februari 1 estim 236000 actual area harvest last campaign 217000 winter rape plant forecast 627000 ha previou estim 621000 375000 rpt 375000 harvest 198586 reuter 
+1,ico coffe produc discuss market situat london april 1 intern coffe organ ico produc meet 1500 gmt 0900 est gener discuss market situat produc spokesman lindenberg sett said brazilian deleg said sever produc request meet brazil among ico execut board regular session week far confin routin matter attempt produc consum reviv export quota negoti deleg said talk restor quota collaps earli last month produc consum fail resolv differ quota alloc produc deleg said sens urgenc among produc reopen quota talk consum countri prepar wait ico annual septemb council session restart negoti member interafrican coffe organ call today produc meet exchang view market situat produc deleg said lack new debat export quota week cite reason renew weak coffe price london new york futur trader said near may london hit fiveyear low morn 1220 stg 50 stg last night close said execut board session look set end today follow final session 1600 gmt 1000 est consult report oper ico present produc consum deleg ad reuter 
+1,asc buy process product domest use kansa citi march 9 agricultur stabil conserv servic asc bought 257 mln pound wheat flour cost 28 mln dlr domest shipment april 115 april 1630 asc spokesman said asc also bought 111 mln pound baker flour 11 mln dlr 19 mln pound pasta 408258 dlr 14 mln pound process cereal product 304043 dlr 48 mln pound corn product 474944 dlr 163 mln pound mill rice 20 mln dlr reuter 
+1,eep wheat west african countriesusda washington june 15 us export opportun sell 170000 tonn wheat west african countri export enhanc program us agricultur depart said said addit benin cameroon ivori coast ghana togo four countri burkina faso gabon liberia niger declar elig initi export sale subsid commod inventori commod credit corpor ccc aid west african countri alreadi purchas 129500 tonn wheat previous announc export bonu program note reuter 
-1,propos japan tax may dampen tokyo gold trade tokyo april 1 propos sale tax gold transact could put damper tokyo market encourag shift trade hong kong singapor senior vice presid tokyo branch manag credit suiss paul hofer told press confer impos five pct buy sell transact tokyo particip gold market could busi said tax would creat spread japanes would unabl compet intern market ad govern realli rais tax system impos prohibit gener busi said govern impos 15 pct tax physic trade exceed 37500 yen gold jewelleri coin 25 yen tax per 10000 yen futur transact gold dealer said new five pct tax would impos compani trade 100 mln yen year appli paper gold trade gold deposit bank trade gold bar well jewelleri coin dealer said howev tax would lower rate jewelleri coin five pct current 15 pct said hofer said 1982 switzerland impos 56 pct gold turnov tax jan 1 1980 abolish oct 1 1986 studi one swiss bank show earli 1980 first year tax volum swiss bank fell 25 pct compar 1978 1979 hofer said transact paper gold also fell 75 pct volum prior imposit tax said gold transact switzerland decreas volum trade outsid countri particularli london luxembourg increas 1025 pct hofer said japan major import gold buy yearli averag 200 tonn gold dealer said last year japan import 600 tonn gold govern bought 300 tonn mint coin commemor 60th year emperor hirohito reign dealer said gold trade tokyo domin mainli japanes trade compani credit suiss major foreign particip daili turnov tokyo spot market rang one 10 tonn averag around three tonn futur turnov amount four tonn gold dealer said us concern daili fact tokyo market grow japan becom one three major financi market world person opinion think would big mistak put damper posit growth develop impos tax hofer said dont think fit philosophi internationalis market ad offici sever major japanes trade hous attend press confer said support credit suiss call govern impos gold tax reuter 
+1,coars grain supplydemand countri usda washington april 9 us agricultur depart detail world supplydemand data major import export coars grain countri follow mln tonn ussr coars grain 198687 198586 040987 030987 040987 030987 start stck na na na na product 10330 10330 9999 9999 import 1200 1000 1370 1370 dome use 11230 11230 11199 11199 export nil nil nil nil end stock na na na na na avail ec12 coars grain mln tonn 198687 198586 040987 030987 040987 030987 start stck 1491 1493 1053 1053 product 8122 8119 8821 8828 import 1658 1726 1829 1824 dom use 7964 8127 8238 8255 export 1990 1996 1973 1956 end stock 1318 1215 1491 1493 eastern europ coars grain mln tonn 198687 198586 040987 030987 040987 030987 start stck 407 372 514 514 product 7395 7450 6828 6838 import 490 447 558 526 dom use 7304 7323 7265 7277 export 355 355 228 228 end stock 634 546 407 372 japan coars grain mln tonn 198687 198586 040987 030987 040987 030987 start stck 232 223 191 191 product 035 035 039 039 import 2156 2150 2151 2151 dom use 2179 2173 2149 2149 export nil nil nil nil end stock 244 244 232 232 argentina coars grain mln tonn 198687 198586 040987 030987 040987 030987 start stck 078 053 083 083 product 1399 1544 1706 1714 import 002 nil nil nil dome use 773 775 776 787 export 660 773 943 958 end stock 046 049 078 053 canada coars grain mln tonn 198687 198586 040987 030987 040987 030987 start stck 619 619 466 461 product 2762 2762 2495 2495 import 030 030 031 031 dom use 1980 1980 1899 1896 export 741 721 474 472 end stock 690 710 619 619 thailand coars grain mln tonn 198687 198586 040987 030987 040987 030987 start stck 049 038 016 016 product 440 440 567 547 import nil nil nil nil dome use 157 137 140 130 export 310 330 394 395 end stock 022 011 049 038 reuter 
+1,adm grain elev explod burlington iowa chicago april 3 grain elev burlington iowa explod today leav five injur elev oper archer daniel midland co decatur ill termin elev mississippi river doug snyder assist vice presid said caus explos extent damag elev immediatley known reuter 
-1,gunnar gold gggto ventur agreement calgari june 29 gunnar gold inc said mill citi gold inc sign option joint ventur agreement tyranex gold inc tyranit gold properti ontario gunnar said mill citi earn 50 pct inter st tyranex option buy tyranit gold mine spend five mln dlr explor develop feasibl studi 1990 said compani may form joint ventur partnership bring mine full commerci product reuter 
-1,campbel ltcch meston lake set gold target montreal april 3 ltmeston lake resourc inc 653 pct own campbel resourc inc said begin commerci output joe mann mine chibougamu area quebec initi daili rate 500 short ton ore grade 015 ounc gold per ton said improv throughput 700 ton day 0221 ounc gold per ton meston said current ore reserv properti total 910000 ton grade 0211 ounc gold per ton 03 pct copper may abl develop substanti greater tonnag meston said underground drill current develop reserv intersect main zone 200 feet bottom level averag grade assay 0530 ounc gold per ton true width 17 feet recent drillhol east current shaft 600 feet reserv boundari intersect three zone grade respect 0708 ounc per ton 54 feet depth 650 feet 0706 ounc seven feet depth 765 feet 0418 ounc one foot depth 1000 feet second surfac hole 500 feet farther east intersect 1068 ounc per ton 53 feet reuter 
-1,magma rais copper price 025 ct 6575 ct new york april 9 magma copper co subsidiari newmont mine corp said rais copper cathod price 025 cent 6575 cent lb effect immedi reuter 
