-1,econom spotlight mitsubishi heavi fight back tokyo march 12 intern effort redirect japan exportdriven economi toward domest consumpt face heavi go countri largest defenc contractor world biggest shipbuild anyth go mitsubishi heavi industri ltd ltmitht mhi began make ship iron good japan militari ruler 130 year ago respond strong yen redoubl effort maintain share export market sell best qualiti cheapest product everyon buy mhi presid yotaro iida said although two mhi main busi shipbuild power plant construct hit hard yen 40 pct rise dollar compani plan abandon iida told reuter interview big activ aircraft compon manufactur perform well mhi account half money tokyo spend defenc procur year made utmost effort among world manufactur improv product said may surpris come see plant outsid old insid ultramodern robot comput secur analyst major secur hous agre mhi pare cost quickli competitor compani slash workforc 47000 86000 1976 despit costcut mhi expect profit drop 40 pct 30 billion yen current fiscal year end march 31 198586 record 5014 billion includ gain sale mhi stake mitsubishi motor corp ltmimtt 49 billion yen iida optimist futur howev said resurg demand middl east follow recent recoveri oil price coupl persist demand power plant develop countri help mhi restor exportstosal ratio past decad averag 30 pct mhi exportstosal ratio fell 259 pct halfyear end last septemb 35 36 pct five year ago china promis market although mhi also consid nonoilproduc develop countri major custom custom seen troubl due lack foreign currenc iida said ad felt mhi could sell market japanes govern financi support also financ plant recov invest product sale strategi iida said could prove popular futur ship mhi fight back lowpric south korean competit build technolog advanc carrier carri liquefi natur ga product difficult transport shipbuild associ offici told reuter mhi world largest shipbuild term order capac domest mhi involv 12 nation project includ develop nuclear fusion reactor launch vehicl manmad satellit biggest contractor japan defenc agenc f15 f14 jet fighter missil although built licenc us firm mhi head five japanes compani seek develop countri fighter plane replac current use f1 support fighter late 1990 militari expert said washington put strong pressur tokyo buy us plane either mcdonnel dougla corp f18 gener dynam corp f16 reduc japan huge trade surplu us might good idea jointli produc plane us maker japan support us defenc umbrella iida said mhi also plan cooper us strateg defenc initi space defenc program particip project move research stage said us seek japan technolog support fiscal 198586 aircraft account 171 pct mhi sale shipbuild 17 pct power plant 279 pct iida said ideal ratio power plant 30 pct aircraft special vehicl 25 pct shipbuild 15 pct remain 30 pct iida said want shift domest focu away heavi machineri sold manufactur toward household good declin specifi product end year may find brand name daili product although mean run away mainstream busi said reuter 
-1,noranda begin salvag oper murdochvil toronto april 9 ltnoranda inc said began salvag oper murdochvil quebec mine fire last week kill one miner caus 10 mln dlr damag anoth 56 miner trap underground long 24 hour brought safeti noranda said caus full extent damag still unknown said know fire destroy 6000 feet conveyor belt noranda said work crew begun secur ramp lead zone fire locat compani said extrem heat fire caus sever rock degrad along sever ramp drift mine noranda estim secur oper zone complet end april noranda said quebec health safeti commiss quebec provinci polic noranda conduct investig fire product mine suspend investig complet copper mine smelter produc 72000 ton copper anod 1986 employ 680 peopl smelter continu oper avail concentr stockpil suppli noranda said reuter reuter 
-1,six kill south african gold mine accid johannesburg oct 19 six black miner kill two injur rock fall three km underground south african gold mine owner said sunday ltrand mine properti ltd one south africa big six mine compani said statement accid occur saturday morn lteast rand proprietari mine ltd mine boksburg 25 km east johannesburg compani spokesman could elabor short statement reuter 
-1,giant bay ltgbylf idaho gold ventur vancouv british columbia april 13 giant bay resourc ltd said sign agreement principl hecla mine co oper joint ventur hecla stibnit idaho gold deposit giant bay said bioleach technolog use ore process right acquir work interest properti said may spend much three mln us dlr exclud capit cost bring mine product said drill indic substanti sulphid reserv gold grade 01 ounc ton earli test show gold ore respond bioleach reuter 
+1,us feedgrain 092 support evalu posit washington march 6 advoc 092 plan feedgrain like delay offer propos disast aid bill hous agricultur committe scale back includ 1987 winter wheat congression sourc said disast aid bill introduc rep glenn english dokla spark sharp controversi propos implement 092 program 1987 wheat 1988 winter wheat agreement reach trim bill back 1987 wheat support 092 feedgrain plan said even scaleddown version would equit farmer unless english bill pertain 1987 winter wheat simpl disast payment feedgrain treat equal said bill narrow winter wheat support 092 feedgrain amend probabl offer propos next week sourc said english agre support amend rep charl stenholm rtex narrow bill 1987 wheat whether would also back reduct unclear agricultur aid english said congressman first choic make option avail 1987 wheat farmer howev polit realiti disast aid winter wheat farmer would unavail controversi spring wheat english might consid even greater cutback bill said 092 plan farmer could forego plant still receiv 92 pct defici payment rep arlan stangeland rminn harold volkmer dmo express interest expand english bill includ 092 program feedgrain aid said stangeland want reopen farm bill fair crop small percentag spring wheat farmer would like sign 092 sinc incent plant greater idl land economist said oppon 092 feedgrain program argu prematur make major chang farm bill hous agricultur committe need studi close impact program reuter 
+1,new zealand may buy us wheat usda washington april 1 new zealand may need 100000 tonn wheat year would normal come australia may unit state us agricultur depart said report export market us grain depart said deregul new zealand wheat board normal import wheat australia possibl wheat purchas unit state sinc ship cost new zealand eastern coast australia west coast unit state equal reuter 
-1,peru say held talk mexico silver lima april 24 head central bank mexico peru met mexico citi coordin action aim consolid upward trend price silver offici newspap el peruano said said peruvian central bank presid leonel figueroa met yesterday presid bank mexico miguel mancera aguayo peru froze new sale refin silver governmentmarket silver ore tuesday world second biggest produc preciou metal mexico largest produc togeth two nation account nearli 40 pct world silver output offici paper el peruano said peru adopt move tuesday bid stablilis price silver bullion climb month 570 dlr ounc 900 dlr ounc today meet peruvian mexican central bank head understood mexico might diversifi use silver el peruano said said mexico peru want specul price silver instead aim see price preciou metal recuper adequ level el peruano specifi level el peruano quot energi mine minist wilfredo huayta say peru want particip specul oper silver said govern aim avoid brutal fall price silver figueroa offic confirm peruvian central bank presid travel mexico citi certain return lima midday today reuter 
+1,asc take step eas sale ccc soybean kansa citi june 15 agricultur stabil conserv servic announc sever temporari step enabl respond quickli high demand commod credit corpown soybean ccc suspend practic contact store warehousemen sell soybean cash third parti said collyn peterson deputi director asc kansa citi offic addit said minimum quantiti sale 25000 bushel warehous total inventori less asc ad telephon line handl call interest buy soybean peterson said reuter 
-1,gmk say three kma partner mull reconstruct melbourn april 27 three australian particip ltkalgoorli mine associ kma gold mine ventur discuss possibl restructur interest ltgold mine kalgoorli ltd gmk kma said particip western mine corp hold ltd ltwmng wmc poseidon ltd ltposa gmk said brief statement gave detail kma own 52 pct ltkalgoorli lake pti ltd klv 48 pct local unit homestak mine co lthm klv turn own 47 pct poseidon gmk six pct wmc kma joint ventur form 1976 oper mount charlott fimiston gold mine western australia two mine produc total 222000 ounc gold 198586 end june 17 kma sole sourc gmk revenu profit major contributor poseidon earn annual report show gmk own 318 pct wmc reuter 
-1,belgium launch bond gold warrant zurich april 9 kingdom belgium launch 100 mln swiss franc seven year note warrant attach buy gold lead manag credit suiss said note 338 pct coupon price par payment due april 30 1987 final matur april 30 1994 50000 franc note carri 15 warrant two warrant requir allow holder buy 100 gramm gold price 2450 franc entir life bond latest gold price zurich 20452070 franc per 100 gramm reuter 
-1,south african gold hold rise march pretoria april 7 south african gold hold rose 17256 mln rand 417 billion rand march rise 39 mln rand 40 billion rand februari reserv bank figur show volum term gold hold rose 551 mln ounc march 526 mln ounc februari valu 75724 rand ounc march versu 75459 rand ounc februari total gold fo reign asset rose 630 billion rand 622 billion gold content increas 6622 pct 643 pct foreign bill remain zero march invest fell slightli 10569 mln rand februari 10656 mln rand asset 202 billion rand 211 billion figur show total liabil fell 1221 billion rand march rise 1362 billion februari reuter 
+1,yugoslavia tender 100000 tonn wheat washington april 9 yugoslavia tender april 14 100000 tonn wheat us agricultur depart counselor belgrad said field report report date april 7 said wheat must 1986 1987 harvest import soft wheat europ supplier consid said import use rebuild feder reserv result subject import surcharg reuter 
+1,wheat class breakdown washington april 9 us agricultur depart gave 198687 breakdown suppli distribut wheat class mln bushel comparison follow hard winter 198687 198586 040987 030987 040987 030987 start stock 1009 1009 717 717 product 1018 1018 1230 1230 ttl supplyx 2027 2027 1947 1947 domest use 599 579 543 543 export 450 475 395 395 total use 1049 1054 938 938 end stock 978 973 1009 1009 note season begin june 1 xinclud import hard spring 198687 198586 040987 030987 040987 030987 start stock 498 498 371 371 product 451 451 460 460 ttl supplyx 956 956 838 838 domest use 218 192 174 174 export 200 190 166 166 total use 418 382 340 340 end stock 538 574 498 498 note season begin june 1 xinclud import soft red 198687 198586 040987 030987 040987 030987 start stock 79 79 64 64 product 290 290 368 368 ttl supplyx 369 369 432 432 domest use 181 193 204 204 export 120 120 149 149 total use 301 313 353 353 end stock 68 56 79 79 note season begin june 1 xinclud import white 198687 198586 040987 030987 040987 030987 start stock 198 198 173 173 product 232 232 254 254 ttl supplyx 433 433 430 430 domest use 82 83 80 80 export 170 160 152 152 total use 252 243 232 232 end stock 181 190 198 198 note season begin june 1 xinclud import durum 198687 198586 040987 030987 040987 030987 start stock 121 121 100 100 product 95 95 113 113 ttl supplyx 221 221 218 218 domest use 54 58 44 44 export 85 80 53 53 total use 139 138 97 97 end stock 82 83 121 121 note season begin june 1 xinclud import reuter 
-1,mint review offer 3701000 lb copper washington april 21 us mint receiv 17 offer seven firm price rang 06684506840 dlr per lb payment standard check 066695068 dlr per lb wire transfer payment review offer 3701000 lb electrolyt copper seek purchas philipp brother ny led lowest offer 066695 wire transfer payment 066845 dlr per lb paid check follow cerro sale corp ny 06684 dlr per lb one mln lb wire payment 06713 dlr per lb one mln lb standard payment firm submit offer elect paid standard check wire transfer award base whichev two method cost advantag time cerro sale also offer price wire payment 06689 dlr per lb one mln lb 06693 dlr per lb 1701000 lb cerro standard payment offer includ 06719 dlr per lb one mln lb 06723 dlr per lb 1701000 lb cargil metal minneapoli offer 067025 dlr per lb wire payment 067275 dlr per lb standard payment elder raw materi darien ct offer 06718 dlr per lb wire payment 06735 dlr per lb standard payment increment 950000 lb offer wire transfer payment includ 06759 dlr per lb 380000 lb submit deak intern ny 06789 dlr per lb entir quantiti diversifi metal corp st loui 068 dlr per lb gerald metal stamford ct standard payment offer includ 06819 dlr per lb 950000 lb diversifi metal 06840 dlr per lb entir quantiti gerald metal mint said copper deliveri week may 11 olin corp east alton ill offer minimum accept period three calendar day said reuter 
-1,comex rais margin gold copper futur effect today open offici date text 
+1,us export report 455000 tonn wheat sold china 198687 198788 date text 
+1,ccc credit bangladesh amend usda washington april 7 commod credit corpor ccc realloc 50 mln dlr credit guarante previous earmark sale us wheat provid coverag sale us veget oil bangladesh us agricultur depart said usda said action taken request bangladesh govern reduc guarante line author wheat sale 250 mln dlr 200 creat new line 50 mln dlr veget oil elig coverag ccc intermedi export credit program credit term must excess three year seven year sale cover credit guarante must regist ship septemb 30 1987 usda said reuter 
+1,french cereal export rouen march pari april 1 french cereal export rouen port rose 751563 tonn march 1 march 25 603413 tonn 1986 period freight sourc said soviet union took 263051 tonn wheat barley saudi arabia 90944 tonn barley china 87259 wheat algeria 64896 wheat bangladesh 30000 wheat morocco 27500 maiz greec 26700 wheat barley spain 25124 wheat poland 24683 wheat brazil 24082 wheat itali 21659 wheat cypru 20700 wheat maiz israel 16500 maiz uk 8797 tonn wheat six ship load 120000 tonn wheat sourc said includ 30000 tonn china 31000 soviet union 25000 turkey 35000 itali anoth ship load 17000 tonn colza soviet union anoth 12 ship arriv load 344000 tonn cereal end week six load 186000 tonn wheat soviet union two load 60000 tonn barley saudi arabia one 28000 tonn wheat china two 25000 tonn wheat algeria turkey one 20000 tonn wheat itali anoth expect load 20000 tonn colza soviet union flour export rouen rose 23457 tonn 25 day period 5500 equival 1986 period sourc said sudan took 19327 tonn west coast africa 4130 four ship current load 32000 tonn includ 24000 egypt 6000 tanzania 2000 mauritania ship expect later week load 12000 tonn china reuter 
+1,us export report 200000 tonn wheat sold jordan 198788 deliveri date text 
-1,silver state mine ltssmc see product rise denver march 6 silver state mine corp said expect gold product year doubl 1986 17458 ounc compani 1985 product 2050 ounc reuter 
+1,ec commiss detail sugar tender brussel april 8 ec commiss confirm grant export licenc 118350 tonn current seri white sugar maximum export rebat 46496 european currenc unit ecu per 100 kilo trader franc receiv 34500 tonn uk 37800 westgermani 20000 belgium 18500 spain 5800 denmark 1750 tonn reuter 
+1,fall soybean crush ratio cut output chicago feb 26 sharp declin soybean crush ratio seen last week acceler recent day push margin cost product soybean process plant prompt mani cut output soybean meal oil weekli us soybean crush rate report nation soybean processor associ afternoon 2178 mln bushel 22 mln bushel plu rate seen past two month crush margin surg best level seen year activ soymeal export load gulf push soybean futur premium higher prompt pickup weekli crush number howev much export demand seem met foreign meal user wait expect surg shipment new crop south american soymeal next month us processor find domest livestock feed demand light time year due milder normal winter steadili drop offer price attempt find buy interest soyproduct dealer said soybean meal futur also steadili declin recent week set new contract low 13970 dlr per ton nearbi march contract today mani specul bought march soymeal sold may look deliveri first notic day tomorrow would caus march gain defer one cbt crush trader said theyv bail week march act like lot deliv tomorrow later month ad result weak soymeal march crush ratio valu soyproduct less cost soybean fell mid 30 earlier month 226 cent per bushel today drop five cent last two day may crush end today 17 cent processor want lock ratio unprofit level trader said hope start cut back product get suppli line demand ad futur processor find must bid premium cash soybean reduc crush margin central illinoi processor make 30 cent everi bushel soybean crush current price sharpli level seen week ago averag cost product cash dealer said soybean process plant still oper littl talk take temporari downtim far processor start halt product next week continu face unprofit margin ad reuter 
-1,homestak lthm mull buy ore reserv new york april 13 homestak mine co consid acquir gold ore reserv addit compani explor effort chief execut harri conger told reuter interview look option acquir reserv rather explor conger said ad move consid acquisit repres chang compani acquisit polici conger said homestak current cash posit 120 mln dlr would avail acquir reserv addit homestak two line credit total 150 mln dlr drawn today could use financ acquisit said conger said anticip 1987 explor budget 1986 spend 273 mln dlr conger said explor preciou metal may slightli higher last year spend 177 mln dlr oil ga explor spend slightli less last year 96 pct conger said see homestak 1987 gold product 1986 gold product 669594 ounc howev 1987 first quarter product mclaughlin reserv 10 pct lower last year 45400 ounc due startup product problem said believ gold price hold 400 us dlr ounc level rest 1987 1986 compani earn base averag market price gold 368 dlr ounc conger said three pct chang gold price repres 12 ct share impact earn declin give specif forecast 1987 first quarter due releas 10 day full year 1987 result reuter 
+1,argentina unaffect brazil maiz decis bueno air march 6 govern offici said decis brazil import maiz forecast record harvest would affect argentina export heard noth brazil decid import maiz problem us one main custom agricultur livestock fisheri undersecretari miguel bracera said privat sourc also said argentina export would affect brazil decis agricultur minist iri resend announc yesterday sao paulo brazil ask argentin maiz said also said smaller crop advers weather summer argentina reduc product bracera said last year brazil bought 800000 tonn argentin maiz year import argentina soviet union argentina main custom japan also becom bigger import countri maiz said reuter 
+1,ugandan govern propos new tax kampala april 24 ugandan govern four year invest develop plan propos tax land food crop attempt broaden revenu base away depend coffe sale govern also said plan made avail reuter devalu ugandan shill would littl redress chronic balanc payment deficit plan first sinc presid yoweri museveni took power 15 month ago seek rais 24 billion dlr invest fund abroad 1987 1991 say govern alreadi secur 14 billion dlr pledg islam lender promis 494 mln dlr confer kampala last week uganda alreadi extern debt 984 mln dlr end 1986 nine month current budget debt servic cost 204 mln dlr almost 50 pct export earn 431 mln plan said new fiscal measur includ propos tax larg land hold regardless whether owner exploit tax maiz bean crop sold produc market board plan say aim spread tax burden uganda tradit fallen almost exclus coffe farmer coffe provid 90 pct foreign exchang earn 70 pct govern revenu exchang rate polici repeat museveni argument form fotat would help alloc resourc western govern multilater fund say ugandan shill grossli overvalu govern must chang exchang rate wish encourag invest shill sell black market 15000 dollar compar offici rate 1400 reuter 
-1,ab gold rais interest canada compani new york april 24 abm gold corp use proce initi public offer seven mln share stock 10 dlr share increas interest three canadian compani said comanag underwrit painewebb inc advest inc abm gold manag develop properti sonora gold corp ltsonto goldenbel resourc inc ltgblto unit gold corp ltugcv inca resourc inc ltirito proce use rais stake sonora buy 15 pct interest net profit sonora jamestown mine buy capit stock goldenbal unit said abm gold explor acquir develop gold properti california also process goldbear ore gold bullion comanag underwrit said sell 35 mln share us canada inter offer manag painewebb intern underwrit grant option buy addit 105000 share cover overallot reuter 
-1,hudson bay mine cut us canada zinc price toronto march 9 lthudson bay mine smelt co ltd said cut price grade zinc sold north america one us ct pound one canadian ct pound effect immedi new price high grade zinc 37 us ct 4912 canadian ct pound compani said special high grade prime western continu galvan grade control lead cost 3712 us ct 50 canadian ct pound new price continu galvan grade alloy control lead aluminum addit 3734 us ct 5014 canadian ct pound reuter 
-1,mueller brass lower product price port huron mich june 2 mueller brass co said effect shipment today adjust price brass mill product except freecut brass rod relat alloy copper water tube relat product reflect contain copper valu 73 cent pound two cent reuter 
+1,brazil buy french wheat tender rio de janeiro april 2 brazil bought 75000 tonn french wheat tonight tender brazilian wheat board spokesman said may shipment accept offer j souflet 50000 tonn wheat 8349 dlr fob per tonn june shipment brazil bought 25000 tonn j souflet also 8349 dlr fob per tonn next tender set april 9 may june juli shipment spokesman said reuter 
+1,turkey elig us bonu rice washington april 3 us agricultur depart said turkey made elig sale 70000 tonn medium grain mill rice depart export enhanc program eep 65 previou eep initi export sale would subsid commod inventori commod credit corp made competit world price usda said reuter 
-1,mexico silver polici unchang offici say mexico citi april 29 mexico polici silver product sale chang despit peru decis last week freez silver sale govern mine central bank offici said offici also express doubt polici chang work mexico world lead silver produc output 739 mln troy ounc last year accord preliminari govern figur peru world second lead silver produc last week suspend sale preciou metal author lima said effort protect price unstabl market sinc decis peruvian offici said discuss cooper silver market mexican offici schedul meet last week peruvian central bank presid leonel figueroa head central bank mexico miguel mancera aguayo met mexico citi privat talk said aim consolid upward trend silver price mexican minist energi mine alfredo del mazo also expect meet peruvian counterpart wilfredo huayta howev mexican decis made follow peruvian exampl suspend new silver sale mexican offici said one mexican mine sector offici work close govern product sale polici told reuter chang polici hand central bank polici follow continu said offici ask identifi spokesman central bank said bank inform silver polici chang energi mine ministri spokesman offici ministri metallurgi depart also said govern silver polici chang made mine sector offici also said doubt mexico would follow peru polici reason two govern intend coordin silver polici mexico would announc sale suspens along peru last week probabl chang wont made offici said reuter 
-1,metal bulletin zinc produc price london april 13 london base trade journal metal bulletin averag produc price good ordinari brand zinc week end april 10 79000 dlr per tonn reuter 
+1,icco buffer stock manag buy 5000 tonn cocoa tuesday june 2 offici date text 
-1,bethlehem steel ltb set steel price increas bethlehem pa oct 20 bethlehem steel corp said price steel sheet product increas 30 dlr ton effect januari 3 increas affect certain noncontract spot transact achiev reduct competit discount compani said transact price contract account durat six month also increas commensur level percentag increas immedi avail price flatrol steel sheet use automobil applianc product vari wide 350 800 dlr ton compani said take action restor sheet transact price equit level mani case price still lower attain 1984 said bethlehem also said respons chang market condit potenti inflationari pressur effort made minin number durat firm price contract reuter 
