+1,japan firm plan sell us farmland japanes morioka japan march 12 japanes real estat compani said launch campaign sell land us farm area rich japanes higashi nippon hous said would offer around 2200 acr land illinoi california florida indiana earli april gaug respons set intern farm corp america chicago last septemb overse oper american farmer would continu work tenant part profit harvest rice corn soybean orang would go japanes investor rental japanes agricultur ministri offici told reuter sale limit farmer keep land agricultur use two year ago began seek farmland japan said isao nakamura presid higashi nippon howev sale japanes farmland strictli control govern began look land us make dream farm land come true nakamura said hundr compani exist us sell farmland investor farmer face difficulti due recess us agricultur reuter 
-1,north bh set oneforf offer norgold float melbourn march 12 north broken hill hold ltd ltnbhame nbh said offer one ltnorgold ltd share everi five nbh share float newli creat gold offshoot 20 cent parvalu share offer 22 cent sharehold regist april 3 nbh said statement norgold issu capit 2405 mln share 63 pct held nbh 89 mln issu sharehold rais 196 mln dlr said norgold take control portfolio preciou metal explor predevelop interest held nbh major gold deposit acquir norgold 100 pct bottl creek deposit west leonora western australia nbh said product gold project annual rate 35000 ounc schedul begin earli 1988 norgold also 10 pct stake coron hill goldplatinum project northern territori 43 pct poona coppergold project south australia gold explor interest acquir norgold western australia queensland new south wale tasmania nbh said reuter 
-1,outokumpu copper deal iberica del cobr helsinki june 26 finland stateown mine compani outokumpu oy said statement enter spanish market sharehold iberica del cobr sa manufactur copper product outokumpu acquir 21 pct share spanish compani compani set agent outokumpu spain deal await approv spanish govern iberica del cobr make tube rod roll drawn copper alloy product sale 87000 tonn output 1986 amount 22 billion peseta outokumpu turnov 1986 758 billion markka reuter 
+1,rotterdam grain handler say port balanc rose rotterdam april 13 graan elev mij gem said balanc port grain oilse deriv rose 146000 tonn april 11 111000 week earlier arriv 404000 tonn discharg 369000 tonn last week balanc compris 21000 tonn grain plu oilse 125000 tonn deriv week estim arriv total 274000 tonn 71000 grainsoilse 203000 deriv figur cover around 95 pct rotterdam traffic product concern reuter 
+1,us senat panel vote limit counti loan rate chang start 1988 crop date text 
+1,ussr seen like honor corn commit washington march 9 soviet union like honor commit unit state buy minimum four mln tonn corn year agricultur depart offici said alway honour agreement there reason think wont year told reuter aggress buy campaign european commun canada us theyr activ buyer sourc point offici said explain depart rais soviet grain import estim today three mln tonn 26 mln tonn dramat shift month ago analyst say ussr might buy us corn first time 15 year drawdown corn suppli china argentina concern soviet winter crop increas competit us corn cite possibl factor creat moscow recent interest lower corn product prospect major suppli countri stir activ big buyer japan soviet also close watch situat offici said soviet tri outcapit capitalist buy corn price get high offici said soon need corn theyll buy ad usda confirm one mln tonn corn sold soviet union us soviet analyst said purchas stand 15 mln tonn usda offici would specul soviet would enter us market definit evolv mind set situat slow grain buy coupl month ago one frenet buy offici said howev situat wheat differ stori said greater world suppli wheat heavier soviet purchas commit less competit us wheat price make soviet purchas us wheat less like said specul continu sever day us consid make export bonu wheat subsidi offer soviet us offici provid confirm reuter 
-1,london gold morn fix highest sinc octob london april 13 gold bullion continu move higher support good gener buy fix morn 43650 dlr 268368 stg ounc friday close 4320050 dealer said set highest sinc octob 8 gold built friday gain base weak dollar fear trade war unit state japan open slightli firmer 4335043400 move steadili morn support commiss hous trade buy dealer said dealer said resist around 44000 sentiment still firm trader believ ralli may even take gold high 500 dlr platinum fix morn 58350 dlr ounc friday close 5785058050 also highest set sinc octob reuter 
+1,uk wheat barley export adjust upward london march 3 uk export 535460 tonn wheat 336750 tonn barley januari home grown cereal author hgca said quot adjust custom excis figur base previou januari figur issu februari 9 wheat export increas nearli 64000 tonn barley 7000 tonn new figur bring cumul w heat export period juli 1februari 13 299 mln tonn barley 296 mln compar 125 189 mln tonn respect year ago januari wheat export compris 251000 tonn european commun destin 284000 tonn third countri soviet union promin third countri destin take 167700 tonn poland credit 54500 south korea 50000 tonn itali largest ec recipi 75000 tonn follow west germani 55200 franc 52000 tonn barley export januari compris 103700 tonn ec 233000 third countri soviet union largest singl import 133265 tonn follow saudi arabia 53800 tonn reuter 
-1,africa mine manag face charg disast johannesburg march 5 seven manag employe gener mine union corp ltd kinross mine ltd face charg culpabl homicid follow last year disast 177 gold miner die attorney gener offic said minework kill last septemb kinross fire set toxic fume suffoc miner underground three accus face altern charg break safeti regul set mine work act spokesman said case would probabl heard witbank region court near kinross midmay reuter 
+1,sugar quota import detail usda washington feb 26 us agricultur depart said cumul sugar import individu countri 1987 quota year began januari 1 1987 end decemb 31 1987 follow quota alloc quota year short ton raw valu cumul quota 1987 import alloc argentina nil 39130 australia nil 75530 barbado nil 7500 beliz nil 10010 bolivia nil 7500 brazil nil 131950 canada nil 18876 quota 1987 import alloc colombia 103 21840 congo nil 7599 costa rica nil 17583 ivori coast nil 7500 dom rep 5848 160160 ecuador nil 10010 el salvador nil 260198 fiji nil 25190 gabon nil 7500 quota 1987 import alloc guatemala nil 43680 guyana nil 10920 haiti nil 7500 hondura nil 159172 india nil 7500 jamaica nil 10010 madagascar nil 7500 malawi nil 9100 quota 1987 import alloc mauritiu nil 10920 mexico 37 7500 mozambiqu nil 11830 panama nil 26390 papua new guinea nil 7500 paraguay nil 7500 peru nil 37310 philippin nil 143780 stchristoph nevi nil 7500 quota 1987 import alloc swaziland nil 14560 taiwan nil 10920 thailand nil 12740 trinidadtobago nil 7500 uruguay nil 7500 zimbabw nil 10920 reuter 
+1,london cocoa trade low midmorn london april 3 cocoa futur fell session low midmorn post loss last night six two stg tonn 1987 deliveri dealer said weekend profittak jobber gener booksquar featur fall aid steadi sterl versu dollar lack offtak physic market dealer said market switch straddlebound pressur one particular month certain reflect adjac deliveri underton howev remain cautiou oper await eventu start icco buffer stock buy dealer said market origin forecast open averag five stg gain last night follow new york firmer close yesterday dealer said larg counterbalanc currenc factor near juli trade session low 1327 stg one hour versu 1333 bid last night earli high 1335 volum midmorn 730 lot includ 350 lot cross 108 switch sign origin activ reuter 
-1,us mint seek 4784000 lb zinc washington march 9 us mint said seek offer 4784000 lb special highgrad zinc intend purchas said sell offer due 1100 hr est march 24 mint said two increment 1300000 lb deliveri week april 13 april 20 ball corp greenevil tenn two increment 1092000 lb deliv week april 20 april 27 lasal roll mill lasal ill firm submit offer may elect receiv payment mint standard check wire transfer award base whichev method cost advantag gover time award determin offer minimum accept period 10 calendar day mint said reuter 
+1,indonesia reject world bank farm reform idea jakarta june 18 indonesia reject world bank recommend sweep reform farm economi countri foreign aid donor met consid give 25 billion dlr grant soft loan agricultur minist achmad affandi written remark distribut today indonesia 14 foreign donor nation met hagu said gener argument present bank free trade open economi view weak bank call overhaul indonesia manag largest farm area southeast asia said agricultur growth stagnat subsidi rice farm bank report said indonesia rice product peak subsidi wast money affandi repli rice main stapl provid incom 17 pct workforc subsidi need support fertil industri includ import export produc distributor said well assist small part major indonesian farmer affandi agre bank recommend farmer free choos crop said govern would continu maintain product target strateg commod rice sugar bank report especi critic indonesia drive plant sugar say domest sugar price doubl world averag ineffici countri would save money import commod howev affandi said volatil world sugar price need save foreign exchang alreadi upandrun sugar industri good argument continu sugar drive also said import barrier trade monopoli agricultur sector need help domest industri develop overproduct price intervent develop nation reuter 
-1,asarco up us lead price 050 ct 27 ct new york april 13 asarco inc said increas base spot sale price refin lead onehalf cent 270 cent lb fob deliv carload lot effect immedi reuter 
-1,noranda mine seen full output month murdochvil quebec april 3 noranda inc said product remain shut firedamag copper mine complet examin mine decid keep mine open would take four five month could resum full product compani spokesman dale coffin said investig could take day sever week would specif noranda said resum product plan oper mine onethird normal 72000 tonn annual finish capac fire start wednesday burn late yesterday weaken part mine support structur coffin said one miner kill 56 other trap underground 24 hour brought safe reuter 
-1,nippon mine lower copper price tokyo april 8 nippon mine co ltd said lower sell price electrolyt copper 10000 yen per tonn 260000 effect immedi reuter 
+1,mexico plan leav ico mexico citi june 2 mexico intent leav intern coffe organ ico event brazil withdraw group mexican coffe institut imc said imc said statement th e ico import instrument ensur produc obtain adequ price mexico current produc around five mln 60kilo bag coffe per year brazil said meet coffe produc rio de janeiro weekend would consid leav ico export quota reduc organ reuter 
-1,pioneer group unit get ghana gold land boston march 6 pioneer group inc said 70 pctown teberebi goldfield ltd ventur grant addit concess land ghana seek mine gold state gold mine corp ghana grant ventur addit 145 squar kilomet teberebi ghana contigu 115 squar kilomet grant earlier origin concess appear substanti amount gold bear materi contain 2 gram 6100 ounc gold per tonn ventur firm estim cost extract gold assur given reserv mine profit compani said said teberebi goldfield conduct test newli grant land ad land seem similar geolog characterist origin land reuter 
-1,peru announc larg new gold find lima march 30 presid alan garcia said peru found gold deposit worth estim 13 billion dlr jungl region near ecuadorean border 1000 km north told report yesterday deposit locat four site near town san ignasio contain equival 100 tonn gold garcia said govern would soon instal two mln dlr treatment plant tomaqu extract enough ore provid estim 25 mln dlr profit end year ad garcia said goldbear deposit locat tamborapa pachapidiana zone cenepa santiago river reuter 
+1,colombia deni sell coffe market bogota march 7 colombia deni sold 440000 60kg bag old crop coffe current market price client europ asia spokesman nation coffe grower feder comment rumour circul market circl said fals reuter 
-1,peru presid warn retali silver lima april 24 peruvian govern freez silver sale contribut sharp boost metal price could draw retali rich nation big trader seek lower price presid alan garcia said peru world second biggest silver produc stop sell refin silver statemarket ore tuesday sinc metal price risen highest level nearli three year close today nine dlr ounc world market garcia said move show small nation like peru could move intern market accept cheap price silver tradit one top revenu earner countri peru export refin silver last year averag price 540 dlr troy ounc recent one month ago silver bullion trade 570 dlr ounc world market one thing peru produc silver sell silent submiss manner price world market want told report presidenti palac nationalist govern say wait moment cant sell silver price ad peruvian energi mine minist wilfredo huayta said govern would maintain freez new sale silver price metal reach true valu raw materi specifi level garcia said rich nation big trader face peru stanc could tri defend stock silver deposit make fictiti sale way tri make price miner fall world market garcia said whatev manoeuvr take answer peru said peru posit action presid garcia recent spoken telephon mexican presid miguel de la madrid huayta said mexico world biggest produc silver mexico peru togeth produc nearli nearli 40 pct world silver offici newspap el peruano said newspap ad peruvian central bank presid leonel figueroa head central bank mexico miguel mancera aguayo met mexico citi yesterday coordin action aim consolid upward trend price metal analyst zurich major silver trade centr said today ralli silver price also fuell investor buy metal protect inflat fear could rekindl dollar weak histor basi silver still rel cheap compar gold investor believ could set stage rise said reuter 
+1,west german tapioca use seen declin hamburg april 29 west german use tapioca like declin despit favour price import licenc 420000 tonn regist sinc start current agricultur year compar 640000 tonn augustapril previou year trade sourc said 12 european commun ec countri licens total 422 mln tonn yearearli period ec contract 317 mln tonn said netherland regist increas licenc around 29 mln tonn 400000 tonn last year said total ec tapioca import current agricultur year expect stagnat last year level around 60 mln tonn sourc said report rise consumpt import licenc franc spain belgium said west german compound feed industri increasingli use grain feed mixtur seller quot tapioca nearbi deliveri around 27 mark per 100 kilo 37 mark march 34 mark april last year feed barley quot 42 mark per 100 kilo result higher west german feed stuff price demand seen slack sourc said west german feed industri tri help cut grain surplu increas use grain feed mixtur ec member countri like take advantag lower tapioca price said reuter 
-1,bethlehem steel ltb rais hpile price bethlehem pa april 2 bethlehem steel corp said effect shipment may 3 transact price hpile increas 30 dlr per short ton compani said new base price coupl revis size extra result publish price 446 dlr per ton hp14 420 dlr hpile size reuter 
-1,asarco up us lead price 050 ct 2650 ct new york april 9 asarco inc said increas base spot sale price refin lead onehalf cent 2650 cent lb fob deliv carload lot effect immedi reuter 
+1,sri lanka appeal drought relief aid colombo march 30 sri lanka appeal 24 countri emerg aid help 24 mln villag affect countri worst drought 36 year govern offici said embassi receiv letter weekend outlin aid need sixth sri lanka popul 13 district letter said govern step avert seriou econom hardship social servic ministri alreadi use entir 1987 budget provis 23 mln rupe distribut help worst hit area letter said 54876 mln rupe need six month period least mayseptemb yala rice crop harvest 25000 tonn wheat rice flour cereal requir said along suppli sugar lentil dri can fish milk serious affect district maha octob 1986april 1987 crop almost complet devast letter said maha paddi output estim 70 mln bushel 20 mln less origin expect two scenario yala crop high forecast around 40 mln bushel condit adequ rainfal within next three four week present drought continu howev product estim around 20 mln bushel letter ad total estim paddi output 1987 would 90 110 mln bushel 135 165 mln tonn rice last year output 124 mln bushel 127 mln 1985 letter said villag serious affect district depriv mean subsist subsidiari crop also fail said govern current budget permit provid sustain adequ relief affect revenu advers affect depress commod price slow economi defenc commit continu exert pressur expenditur side 54876 mln cash would cover payment 150 rupe per month famili well handl transport distribut emerg food outlay fund govern would possibl without serious impair develop project greatli fuell inflat economi letter said letter said food depart would abl releas wheat rice buffer stock meet immedi cereal requir provid stock replac subsequ meteorolog depart said countri experienc worst drought sinc 1951 fourmonth dri spell prevail area would break monsoon rain fell late may letter said area experienc drought sinc august rice grow district kurunegala effect rainfal sinc june 1986 reuter 
+1,cuban cattl threaten drought havana march 5 750000 head cattl suffer effect sever shortag feed result prolong drought normal rich sugar cattl produc provinc camaguey newspap granma report provinc produc 23 pct cuba beef island number two provinc milk product granma said 20000 head cattl immin danger newspap said cattl emerg decre cattl round 110000 head transfer sugar cane condit center newli harvest cane clean sent mill cattl fed residu left clean cane stalk 32000 head sent nearbi provinc la tuna ciego de avila despit cuba ambit cattl develop plan beef ration effect past 25 year havana cuban receiv approxim 34 lb ration beef everi 18 day major area hit drought san miguel practic rain fallen past 14 month graze land parch region unabl produc 117000 tonn silag project annual plan granma said rainfal past year less 50 pct normal precipit reuter 
-1,stelco ltsteato uswa reach contract settlement toronto april 27 stelco inc said contract negoti unit steelwork america conclud memorandum settlement new threeyear collect agreement cover 12000 worker 15 stelco plant term new agreement immedi disclos compani said earli negoti began march 2 1987 order reach new contract well juli 31 1987 expiri exist contract said new contract endors negoti committe union local repres stelco worker reuter 
-1,taiwan see sharp declin shipbreak taipei april 1 taiwan shipbreak industri expect declin sharpli year despit boom 1986 keener competit south korea china rise taiwan dollar us import curb steel product industri sourc said last year taiwanes breaker demolish record 344 vessel total 369 million light displac ton ldt 165 297 million ldt 1985 lin chungjung taiwan shipbreak industri associ tsia spokesman told reuter china scrap vessel 11 mln ldt last year south korea demolish ship 910000 ldt said yao liu presid chi shun hwa steel co lead shipbreak steel produc kaohsiung told reuter expect scrap fewer ship year expect declin steel product export lin said mani breaker predict 20 pct declin scrap oper year due fall demand us japan southeast asia taiwanes steel taiwan agre last year voluntarili limit steel product export us 120000 tonn first half 1987 260000 tonn first half 1986 taiwan steel iron associ offici said yao said rise taiwan dollar mean taiwan steel export expens south korea china taiwan dollar strengthen 16 pct us unit sinc septemb 1985 banker economist said could appreci 32 us dollar end year 3423 today yao said comparison rose five pct yuan remain stabl period ad lost order south korea mainland china foreign import switch purchas said taiwan steel export us japan southeast asia slip 148000 tonn first two month 1987 220000 tonn year earlier taiwan steel iron associ offici said said expect declin later month give figur reuter 
-1,minpeco lift forc majeur zinc ingot shipment cajamarquillaspokesman date text 
+1,usda comment export sale report washington april 9 us corn sale 10 mln tonn week end april 2 eight pct prior week 25 pct fourweek averag us agricultur depart said comment latest export sale report depart said iraq japan ussr largest buyer sale next market year begin septemb 1 total 503200 tonn mainli iraq taiwan wheat sale 119300 tonn current season net reduct 13700 tonn 198788 season fourfifth combin total prior week fourweek averag said sri lanka activ wheat destin purchas 52500 tonn current year said signific purchas current year mexico hondura said soybean sale 240500 tonn onefifth prior week nearli onethird fourweek averag japan mexico south korea itali israel major purchas depart said net sale 117700 tonn soybean cake meal fell 31 pct previou week 38 pct fourweek averag major increas west germani venezuela netherland saudi arabia partial offset reduct unknown destin usda said activ soybean oil result decreas 2400 tonn sale unknown destin 2700 tonn sale canada increas 200 tonn depart said combin sale 71300 run bale cotton 60200 bale current season 11100 bale 198788 season fourfifth higher prior week level nine pct fourweek averag mexico domin buyer current year follow zair itali spain depart said primari buyer 198788 season south korea spain japan taiwan depart said sorghum sale 143300 tonn 25 pct less prior week japan venezuela main buyer reuter 
+1,renew usussr grain pact said uncertain washington march 4 prospect renew fiveyear usussr grain agreement uncertain point soviet trade offici told reuter current trade imbal unit state soviet union high us commod price increas world grain product make renew suppli agreement next year less certain albert melnikov deputi trade repres soviet union said interview current agreement expir sept 30 1988 melnikov said world grain market differ first agreement sign 1975 statement us soviet offici indic long term grain agreement might attract side one agreement second agreement second agreement weve difficulti price melnikov said cannot give forecast respons futur agreement want specul happen sept 30 1988 said melnikov note seen indic soviet govern offici would push renew agreement situat differ comparison three five ten year ago produc said reuter 
-1,us steel firm studi usx unit price hike new york june 18 two major steel compani said studi price increas announc yesterday usx corp uss steelmak divis spokesman armco inc bethlehem steel corp said propos price hike studi yesterday uss said plan rais base price plate product 20 dlr short ton five pct effect shipment octob 4 spokesman ltv steel co unit ltv corp declin comment ad compani make heavi plate make plate product reuter 
-1,copper studi group consid geneva meet geneva march 3 major copper produc consum countri consid us propos set studi group review world copper market deleg said us initi introduc last decemb meet held auspic unit nation confer trade develop unctad us world largest copper consum second biggest produc chile propos set bodi improv statist market transpar copper economi provid forum discuss new bodi would aim negoti measur stabilis depress world price week meet began yesterday due end friday reuter 
+1,china sugar output seen lower usda washington march 4 china 198687 sugar crop revis 526 mln tonn raw valu four pct previou forecast five pct previou season us agricultur depart said world product trade report depart attribut declin rel poor profit sugar caus harvest area cane beet declin seven pct 198586 beet sugar product 198687 estim 837000 tonn five pct less earlier forecast five pct previou season cane output project 4423 mln tonn four pct previous forecast five pct previou season said reuter 
